{
  "pensionSavingsTaxCharges": {
    "isAnnualAllowanceReduced": true,
    "taperedAnnualAllowance": true,
    "moneyPurchasedAllowance": false,
    "pensionSchemeTaxReference": ["00123456RA", "00123456RA"],
    "lumpSumBenefitTakenInExcessOfLifetimeAllowance":
      {
        "amount":100,
        "taxPaid":100
      }
    ,
    "benefitInExcessOfLifetimeAllowance":
      {
        "amount":100,
        "taxPaid":100
      }
  },
  "pensionSchemeOverseasTransfers": {
    "overseasSchemeProvider": [
      {
        "providerName": "Overseas Pensions Plc.",
        "providerAddress": "111 Main Street, Any Town, Any City",
        "providerCountryCode": "CYM",
        "qualifyingRecognisedOverseasPensionScheme": ["Q1234"]
      }
    ],
    "transferCharge": 100,
    "transferChargeTaxPaid": 100
  },
  "pensionSchemeUnauthorisedPayments": {
    "pensionSchemeTaxReference": ["00123456RA", "00123456RA"],
    "surcharge": {
      "amount": 100.99,
      "foreignTaxPaid": 100.99
    },
    "noSurcharge": {
      "amount": 100.99,
      "foreignTaxPaid": 100.99
    }
  },
  "pensionContributions": {
    "pensionSchemeTaxReference": ["00123456RA", "00123456RA"],
    "inExcessOfTheAnnualAllowance": 100,
    "annualAllowanceTaxPaid": 100
  },
  "overseasPensionContributions": {
    "overseasSchemeProvider": [
      {
        "providerName": "Overseas Pensions Plc",
        "providerAddress": "111 Main Street, Any Town, Any City",
        "providerCountryCode": "CYM",
        "qualifyingRecognisedOverseasPensionScheme": [
          "Q123456"
        ]
      }
    ],
    "shortServiceRefund": 123.0,
    "shortServiceRefundTaxPaid": 123.0
  },
  "links":[
    {
      "href":"/individuals/charges/pensions/TC663795B/2021-22",
      "method":"GET",
      "rel":"self"
    },
    {
      "href":"/individuals/charges/pensions/TC663795B/2021-22",
      "method":"PUT",
      "rel":"create-and-amend-charges-pensions"
    },
    {
      "href":"/individuals/charges/pensions/TC663795B/2021-22",
      "method":"DELETE",
      "rel":"delete-charges-pensions"
    }
  ]
}